slug,nome,preco,preco_original,desconto_pct,avaliacao,vendidos,estoque,tem_video,url,descricao
"9zupangBmu","Blusa Feminina Crepe Duna Decote V Manga 3/4 Soltinha Elegante Tendência","24.99","26.99","7%","0.0","0","158316","false","https://shopee.com.br/opaanlp/792952722/58260172435","Blusa Feminina em Crepe Duna – Elegância, Conforto e Versatilidade Perfeita para quem busca uma peça leve, sofisticada e fácil de combinar. Essa blusa possui modelagem moderna com decote em V que valoriza o colo e traz um toque elegante ao look. Ideal para o dia a dia, trabalho, passeio ou ocasiões especiais. 🔥 Destaques do Produto: ✔ Veste bem em diferentes tipos de corpo ✔ Modelagem que valoriza a silhueta ✔ Tecido leve que NÃO marca excessivamente ✔ Pode usar sem sutiã (não fica transparente"
"AAEFn6fYRx","1/2/3 Cola Calçados Cola Pra Conserto De Sapatos Cola Para Conserto De Sapatos Resistente A Altas Temperaturas","11.98","20.01","40%","4.6","4039","306","true","https://shopee.com.br/opaanlp/299222557/58252841983","Tempo de processamento do pedido de pedido de até 2 dias úteis: Até 2 dias úteis Tempo estimado de entrega: 3-5 dias úteis Entre em contato conosco se tiver alguma dúvida ou precisar de ajuda. Descrição do produto: Nome: TERTELL Cor da marca: Transparente + cor transparente Odor: baixo odor Tipo: Cola Sapato Resina Validade: 12 meses Especificações do produto: Grande capacidade Tempo de operação: 30 minutos Para Âmbito de Aplicação: Para Degumming Sapatos Bonding Características: 1. Pode reparar"
"AKXfzPev70","Moletom Canguru Masculino Banda Stray Kids Blusa de Frio Premium Casaco Inverno Unisex","99.99","99.99","0%","0.0","0","99226","true","https://shopee.com.br/opaanlp/1077144780/58209766469","Peça Essencial - Moletom Canguru Premium Qualidade que Você Sente, Conforto que Você Merece Na Peça Essencial, acreditamos que um bom moletom é mais do que uma roupa - é aquela peça indispensável do seu guarda-roupa. Por isso, oferecemos moletom canguru com 300 de gramatura, pensado para quem valoriza qualidade superior e durabilidade. O que torna nosso moletom essencial? ✨ Gramatura 300 - A Diferença que Você Sente: Tecido encorpado e resistente que proporciona aquecimento perfeito e durabilida"
"AUr6BieHm3","Dupla Body Splash Delight Barbour's Beauty 200ml Perfume Feminino","79.03","112.90","30%","4.9","238","45952","false","https://shopee.com.br/opaanlp/1579330222/58260056158","DUPLA BODY SPLASH DELIGHT BARBOUR´S BEAUTY 200ML  A Dupla Delight da Barbour’s Beauty é perfeita para quem ama fragrâncias femininas delicadas, frescas e envolventes. O Body Splash Delight combina notas de lichia, ruibarbo e bergamota na  saída, trazendo frescor e energia. No coração, rosa turca e peônia criam uma  assinatura floral elegante. Ao fundo, cashmeran, incenso, cedro e vetiver  trazem conforto, sofisticação e durabilidade. Com duas unidades, o kit oferece excelente custo-benefício, id"
"809lD7nnqa","Kit Trio Pulseiras Fita Ponto Luz Trançada Banhado Prata 925","17.00","129.00","87%","4.8","171","150000","false","https://shopee.com.br/opaanlp/368039476/58207970054","Kit Trio Pulseiras Fita Ponto Luz Trançada Banhado Prata 925 kit de pulseiras com 19 centimetros com alongador prata 925 banhado a prata 925"
"8ATBPQnAVd","3 / 6 / 9 / 12 / 18 / 24 Pares de Meias Femininas Soquete Cano Curto Estampadas Cores Variadas Confortável","12.90","35.00","63%","4.8","4210","53714","true","https://shopee.com.br/opaanlp/493828477/58207667280","ADQUIRA JÁ SUA MEIA NA BL SOCKS!  QUANTIDADES: COM 3, 6, 9, 12, 18 E 24 pares! Experimente o toque suave do algodão a cada passo. Peça as suas agora! Tamanho: 35 ao 40 Modelo: Meia Soquete / Sapatilha / Cano Curto A cor vai SORTIDA de acordo com o estoque; Obs: Podem ir estampadas ou lisas (conforme nosso estoque). 🧦 Maciez Suprema: Nossas meias soquete são feitas com materiais que proporcionam uma sensação de conforto e maciez como nenhum outro. Seus pés vão agradecer a cada passo! 🎨 Estilo I"
"8KmbbjmXAg","Moletom Canguru Masculino Exclusiva Aranha Streetwear Algodão Premium Blusa de Frio Inverno","99.99","99.99","0%","5.0","1","260","true","https://shopee.com.br/opaanlp/1077144780/58259736335","Peça Essencial - Moletom Canguru Premium Qualidade que Você Sente, Conforto que Você Merece Na Peça Essencial, acreditamos que um bom moletom é mais do que uma roupa - é aquela peça indispensável do seu guarda-roupa. Por isso, oferecemos moletom canguru com 300 de gramatura, pensado para quem valoriza qualidade superior e durabilidade. O que torna nosso moletom essencial? ✨ Gramatura 300 - A Diferença que Você Sente: Tecido encorpado e resistente que proporciona aquecimento perfeito e durabilida"
"8V61o2ltpj","Kit com 3 Cremes Hidratantes Corporais Nativa Spa – 400ml Cada","27.99","55.98","50%","3.0","2","9998","false","https://shopee.com.br/opaanlp/1420372901/58202126334","Kit com 3 Cremes Hidratantes Corporais Nativa Spa – 400ml Cada O Kit Nativa Spa com 3 Cremes Corporais de 400 ml oferece hidratação intensa, cuidado completo e fragrâncias sofisticadas para a pele. Desenvolvidos com fórmulas nutritivas, os cremes ajudam a restaurar a maciez, fortalecer a barreira natural da pele e prevenir o ressecamento, proporcionando conforto e bem-estar ao longo do dia. Com textura cremosa e rápida absorção, os cremes deslizam facilmente sobre a pele, garantindo toque suave "
"8fPS0LlGUm","Mochila Bolsa Reforçada Notebook Resistente Trabalho Faculdade Coreana","31.50","73.00","57%","4.5","46483","97883","true","https://shopee.com.br/opaanlp/752743341/18350470458","Produto à Pronta Entrega (em SP) - Enviamos sua compra em até 24h - Atendimento Personalizado e Educado :: DESCRIÇÃO DO PRODUTO ABAIXO (leia toda a descrição antes de comprar) Adquira a sua mochila que foi desenvolvida para acomodar seus pertences com melhor aproveitamento do espaço interno, a mochila possui 3 compartimentos com Zíper além de 2 bolsos laterais e compartimento interno para notebook, além de todo esse espaço a mochila é resistente a água, suportando até 20 minutos em chuvas, ideal"
"8pisCekd9p","Mochila Bolsa Reforçada Notebook Resistente Trabalho Faculdade Coreana","31.50","73.00","57%","4.5","46483","97882","true","https://shopee.com.br/product/752743341/18350470458","Produto à Pronta Entrega (em SP) - Enviamos sua compra em até 24h - Atendimento Personalizado e Educado :: DESCRIÇÃO DO PRODUTO ABAIXO (leia toda a descrição antes de comprar) Adquira a sua mochila que foi desenvolvida para acomodar seus pertences com melhor aproveitamento do espaço interno, a mochila possui 3 compartimentos com Zíper além de 2 bolsos laterais e compartimento interno para notebook, além de todo esse espaço a mochila é resistente a água, suportando até 20 minutos em chuvas, ideal"
"902IOxjzos","Moletom Canguru Feminino Stray Kids Banda Kpop Skz Skzoo Unissex Premium Blusa de Frio","99.99","99.99","0%","0.0","0","99270","true","https://shopee.com.br/opaanlp/1077144780/23699442916","Peça Essencial - Moletom Canguru Premium Qualidade que Você Sente, Conforto que Você Merece Na Peça Essencial, acreditamos que um bom moletom é mais do que uma roupa - é aquela peça indispensável do seu guarda-roupa. Por isso, oferecemos moletom canguru com 300 de gramatura, pensado para quem valoriza qualidade superior e durabilidade. O que torna nosso moletom essencial? ✨ Gramatura 300 - A Diferença que Você Sente: Tecido encorpado e resistente que proporciona aquecimento perfeito e durabilida"
"9ALibGjMTv","Moletom Canguru Feminino Stray Kids Banda Kpop Skz Skzoo Unissex Premium Blusa de Frio","99.99","99.99","0%","0.0","0","99270","true","https://shopee.com.br/product/1077144780/23699442916","Peça Essencial - Moletom Canguru Premium Qualidade que Você Sente, Conforto que Você Merece Na Peça Essencial, acreditamos que um bom moletom é mais do que uma roupa - é aquela peça indispensável do seu guarda-roupa. Por isso, oferecemos moletom canguru com 300 de gramatura, pensado para quem valoriza qualidade superior e durabilidade. O que torna nosso moletom essencial? ✨ Gramatura 300 - A Diferença que Você Sente: Tecido encorpado e resistente que proporciona aquecimento perfeito e durabilida"
"6feNcfssYS","Kit 3 Gel Sebo de Carneiro Hidratante Pele Renovada Nati Corporal Pés + Necessaire Brinde 150mL","14.95","19.95","25%","4.9","514","377","false","https://shopee.com.br/product/287079590/58210354378","Kit especial com 3 Cremes Sebo de Carneiro Nati Tradicional + brindes exclusivos para deixar sua rotina de cuidados ainda mais completa. Ideal para hidratar profundamente a pele, deixando mãos, pés, cotovelos e áreas ressecadas muito mais macias e renovadas. O creme Sebo de Carneiro Nati possui fórmula enriquecida com ureia e cacau, auxiliando na hidratação intensa da pele seca e áspera, proporcionando toque suave e sensação de pele cuidada por muito mais tempo. O kit contém: • 3 Cremes Sebo de "
"6pxnoysFDV","Base BB Cream Cushion /Corretivo com Esponja co Formato de Cogumelo  Base Clareador Maquiagem Creme Clareador Lové Rain","24.88","35.99","31%","4.9","2154","46271","true","https://shopee.com.br/opaanlp/1485160784/20398143226","Base BB Cream Cushion - Lové Rain Essa base linda que vem dentro uma esponja para você aplicar, é a nossa queridinha do momento!  Cobertura e acabamento leve, deixando sua pele viçosa e bonita sem marcar."
"70HE1HrbsY","Moletom Canguru Masculino Estampado Skyline Gtr R34  Blusa De Frio Premium Carro Turbo Inverno","99.99","99.99","0%","5.0","4","298","true","https://shopee.com.br/opaanlp/1077144780/58259802662","Peça Essencial - Moletom Canguru Premium Qualidade que Você Sente, Conforto que Você Merece Na Peça Essencial, acreditamos que um bom moletom é mais do que uma roupa - é aquela peça indispensável do seu guarda-roupa. Por isso, oferecemos moletom canguru com 300 de gramatura, pensado para quem valoriza qualidade superior e durabilidade. O que torna nosso moletom essencial? ✨ Gramatura 300 - A Diferença que Você Sente: Tecido encorpado e resistente que proporciona aquecimento perfeito e durabilida"
"7AaeDaqyXb","Kit 6 e 12 Pares de Meias Masculino para Recém Nascidos e Bebê Menino c/ Antiderrapante","15.90","25.99","39%","4.9","5983","7140","true","https://shopee.com.br/opaanlp/1643565306/22798989144","✅O PACOTE INCLUI ⭐️ Kit Pares Meia Infantil para Recém Nascidos e Bebê Menino c/ Antiderrapante ✅Tamanhos disponíveis: 🧦0-6 Meses 🧦6 a 12 meses 🧦12 a 24 meses 🧦 2-4 anos 🧦 2-4 anos 🧦 4-6 anos 🧦 6-8 anos ✅DESTAQUES -Material macio, confortável de usar -Respirável e absorvente de suor, elimina a transpiração para mantê-lo seco -Ótimo para as crianças ✅DESCRIÇÕES -💕Padrão: Estampado -💕Estilo: Basico, Casual -💕Temporada: Primavera/Verão/Outono/Inverno -💕Ocasião: Em casa / uso diário / esc"
"7Ku4PtqLCe","Kit com 5 - Lenço Umedecido Turminha da Bagunça Toalha Umedecida 48 Unidades","18.99","32.90","42%","4.6","4718","415","true","https://shopee.com.br/opaanlp/321128579/17422129005","Lenço Umedecido Turminha da Bagunça Toalha Umedecida 48 Unidades Recomendação: As toalhas Umedecidas Turminha Da Bagunça oferecem todo cuidado que a pele sensível do eu bebê merece, além de promover Higiene a eles. Sua formula conta com a presença do extrato de Aloe Vera, Extrato de calêndula, pantenol e Vitamina E que trazem o poder de Hidratação e maciez ainda mais profundo. As ações Anti-flamatória e cicatrizante dos extratos protegem seu bebê contra as assaduras e irritações. Recomendado tam"
"7fWuoVp4Wk","Maquiagem junina adesiva, autocolante  kit 1 maquiagem completa contendo, 2 bandeirolas. 2 fogueiras,2 girasois...","19.90","19.90","0%","4.9","1511","7180","true","https://shopee.com.br/opaanlp/323364785/22494052851","adesivo para pele em vinil pvc extra fino, fácil de aplicar e fácil de remover,  NÃO É TATUAGEM TEMPORÁRIA! NÃO SOLTA TINTA . Delicado e feito a mão de forma artesanal para melhor atender os seus pequenos, em nossa loja temos versões com mais quantidades. 12 pintinhas para as bochechas  2 trios de bandeirolas  2 fogueirinhas  3 estrelas 6 coração 2 girassois  pode molhar, suar que não estraga."
"7pqL0ooRBn","Meia-Calça Térmica Feminina Peluciada Translúcida Alta Elasticidade Super Quente Para Inverno","21.99","99.00","78%","4.9","11104","712","true","https://shopee.com.br/opaanlp/1671173223/22799419082","Meia Calça Térmica da marca L.M🔥 Primeira marca a criar Meia Calça Térmica, quem é atento vai perceber que praticamente todas as meias calças térmicas vendidas na Shopee vêm da L.M. Temos um design exclusivo e também fazemos um estudo detalhado sobre o corpo dos nossos clientes. O corpo em forma de pera dos brasileiros, ou seja, o corpo em forma de ""A"", nos inspirou a criar o produto mais adequado para nossos clientes brasileiros. Em 2️⃣0️⃣2️⃣5️⃣, fizemos uma grande atualização. Este ano, desen"
"5L902DxxGK","Roupa de Cachorro Gato Frio Inverno Pequenos Medios Grande Porte SF","30.70","30.70","0%","4.9","14755","56266","false","https://shopee.com.br/product/364843650/19299663655","Este suéter foi desenvolvido para proporcionar conforto e proteção para seus animais de estimação durante os dias frios ❄️. Perfeito para cães e até mesmo gatos 🐱. Seu design oferece um ajuste perfeito e aconchegante, mantendo os pets quentes e confortáveis 🔥. -Não podemos alterar cor ou tamanho pois sai na NF o que está sendo enviado. - TABELA DE MEDIDAS SE ENCONTRA NAS FOTOS DO ANÚNCIO.  - 100% Novo e de Alta Qualidade✨: Produzido com material de fibras acrílicas de excelente qualidade, gara"
"5VSQEWxJvN","Kit Corporal Nativa Spa com 3 Hidratantes de 400ml","27.99","27.99","0%","3.6","61","99326","false","https://shopee.com.br/product/383740485/58205413442","Kit Corporal Nativa Spa com 3 Hidratantes de 400ml O Nativa Spa Kit Corporal Hidratante com 3 unidades de 400 ml foi desenvolvido para proporcionar hidratação profunda, cuidado diário e fragrâncias sofisticadas para a pele. Suas fórmulas nutritivas auxiliam na reposição da umidade natural, ajudam a fortalecer a barreira cutânea e previnem o ressecamento, deixando a pele macia, suave e bem cuidada ao longo do dia. Com textura cremosa e rápida absorção, os cremes deslizam facilmente sobre a pele, "
"5flqQpwgaQ","Tênis Infantil Calce Facil Masculino Bevolo Calçados.","19.00","69.80","73%","4.9","31351","277080","false","https://shopee.com.br/product/676684389/20899598197","O Tênis Calce Fácil Infantil Bevolo é a escolha perfeita para os pequenos que buscam conforto e praticidade no dia a dia. Ele proporciona uma experiência de uso superconfortável, além de ser fácil de calçar, o que garante mais autonomia para as crianças. Seu design moderno e versátil combina com diferentes looks, sendo ideal para escola, lazer ou passeios. Tudo isso com a garantia de durabilidade e estilo que os pais procuram."
"5q5Gd8w3FT","Kit 12 Pares de Meia Cano Alto","10.99","65.00","83%","4.8","8272","116884","true","https://shopee.com.br/product/1013333026/22297378465","Descubra o conforto supremo das nossas Meias Cano Alto de Algodão em três cores incríveis: preto, branco e cinza.  Escolha a quantidade que você precisa - Kits com 3, 6, 9 e 12 Pares. Experimente o toque suave do algodão a cada passo. Peça as suas agora! Tamanho: ÚNICO, servem do 36 ao 44. 🧦 Maciez Suprema: Nossas meias cano alto são feitas com materiais que proporcionam uma sensação de conforto e maciez como nenhum outro. Seus pés vão agradecer a cada passo! 🎨 Estilo Inigualável: Disponíveis "
"60OgpRvPuW","Protetor De Sapato Impermeável De Silicone Capa de Chuva Para Tênis Colorido e Unisex Joven e Adulto","11.90","21.00","43%","4.5","54742","493662","true","https://shopee.com.br/product/1097148583/23298100712","""Capa de tênis reutilizável, de silicone, dupla camada, impermeável e antiderrapante - O companheiro perfeito para sair nos dias de chuva Seja você um explorador ao ar livre apaixonado por acampar e caminhadas, ou um trabalhador que precisa se deslocar diariamente para o trabalho ou para afazeres, esta capa de tênis atenderá às suas necessidades. Durante o acampamento, ela protege contra a água da orla e chuva repentina; durante as caminhadas, protege seus sapatos contra a lama e a erosão de are"
"6Ai71kumZZ","Moletom Canguru Masculino Estampa Capivara Milk Fofa Tumblr Com Capuz Casaco Blusa de Frio Premium","99.99","99.99","0%","0.0","0","109245","true","https://shopee.com.br/product/1077144780/58209798552","Peça Essencial - Moletom Canguru Premium Qualidade que Você Sente, Conforto que Você Merece Na Peça Essencial, acreditamos que um bom moletom é mais do que uma roupa - é aquela peça indispensável do seu guarda-roupa. Por isso, oferecemos moletom canguru com 300 de gramatura, pensado para quem valoriza qualidade superior e durabilidade. O que torna nosso moletom essencial? ✨ Gramatura 300 - A Diferença que Você Sente: Tecido encorpado e resistente que proporciona aquecimento perfeito e durabilida"
"6L1XE3u9Ec","Calça Feminina TACTEL COM ELASTANO PREMIUM jogger / ideal para academia,yoga, casual e esportiva","36.49","99.90","63%","4.8","14317","21522","true","https://shopee.com.br/product/1587235748/22394250261","Calça Feminina Esportiva com Elastano – Conforto, Estilo e Liberdade para seus Treinos TECIDO FRESCO, IDEAL PARA TODAS AS ESTAÇÕES DO ANO. NÃO POSSUI ZIPER NO BOLSO Destaque-se nos treinos com essa calça feminina feita em tecido tactel leve com elastano, perfeita para garantir liberdade de movimentos e máximo conforto. Com costuras reforçadas, ela oferece mais durabilidade e segurança nos exercícios. O cós com cordão de ajuste permite melhor encaixe ao corpo, enquanto a barra com punho dá um toq"
"6VKxQMtVtf","KIS 2 Meia Cano Curto Peluciada Feminina Juvenil E Adulto Unixes","9.99","19.99","50%","4.8","3827","4711","false","https://shopee.com.br/product/437985893/22392924019","Entrega aleatória Enviar Aleatório SE PROTEJA NO INVERNO. MEIA CARNEIRO PROTEGER E AQUECER OS PÉS.  Material com Elastano, Vestindo e tomando forma do pé.  Serve perfeitamente nos tamanhos unico Qualidade e Conforto neste modelo importado.  -Antiderrapante na sola; -Substitui perfeitamente a Pantufa; -Bem Grossa; -Forrada com lã de Ovelha;  -Aquece e mantém os pés em ótima temperatura no inverno;  -É mais quente que as meias de fibra sintética; COMPRE COM SEGURANÇA E TRANQUILIDADE. Postamos os p"
"40dcRm31yC","Óleo Capilar Superpoderoso Cresce E Acontece 7Ml","10.90","24.90","56%","4.9","10706","1928","false","https://shopee.com.br/product/427106553/42727283804","Descrição: Desenvolvido para fios finos, fragilizados e quebradiços, o óleo capilar cria um verdadeiro escudo protetor contra os danos diários, preservando a leveza e o brilho natural do cabelo. O óleo de semente de uva é rico em antioxidantes e ácidos graxos que protegem contra os danos do sol e da poluição, enquanto o óleo de rícino hidrata, nutre e estimula o crescimento saudável dos fios. Já o mix de ômegas reforça a barreira protetora, reduzindo a quebra e mantendo o cabelo mais flexível e "
"4Ax2e52OdF","NOVA Luva motoqueiro inverno Frio Touch Screen  Motociclista Cano longo Adequado Para Moto","8.20","50.00","84%","4.6","3834","10050709","true","https://shopee.com.br/product/1719334016/58204987358","Esta é a nossa luva de moto de moda, que é um dos nossos produtos principais na loja. O design da luva é elegante e único, destacando sua personalidade e estilo. Esta luva é perfeita para aqueles que desejam mostrar moda e personalidade ao andar de moto. A luva não apenas protege suas mãos, mas também aumenta seu charme de moda.  Se você está procurando uma luva de moto prática e elegante, esta luva é a melhor escolha para você. Características: - TAMANHO UNICO - Costuras reforçadas - Antiderrap"
"4LGSqO1lII","Cola adesiva forte para sapatos - para reparação de calçado, soluções de reparação duradouras para solas","14.97","23.00","35%","4.8","22669","2832","true","https://shopee.com.br/product/1566452692/22594546423","Obrigado por considerar nosso Adesivo Universal Forte para Sapatos! Este adesivo de alta qualidade é perfeito para todas as suas necessidades de reparo de calçados. Feito de materiais duráveis e à prova d'água, garante uma ligação duradoura, sendo ideal tanto para sapatos casuais quanto esportivos. Cada embalagem contém uma bisnaga, oferecendo quantidade suficiente para vários reparos. 🛠️ Cenas de Uso Seja consertando um par favorito de tênis ou restaurando uma amada bota, nosso adesivo para sa"
"4VZt2h17xL","Kit 3/6 pares de meia/meias soquete térmica grossa flanelada fleece inverno frio intenso Luca","19.99","100.00","80%","4.8","11527","14213","false","https://shopee.com.br/product/1255854196/18799319252","   💫💙 Seja Bem vindo(a) a loja Luca Fashion💙💫 Meia Térmica Soquete Feminina Flanelada – Forrada para Inverno As meias térmicas soquete femininas flaneladas são ideais para os dias frios, oferecendo conforto, aquecimento e maciez para manter seus pés sempre protegidos durante o inverno. Confeccionadas com material de alta qualidade e excelente durabilidade, possuem interior flanelado que ajuda a reter o calor, proporcionando uma sensação agradável ao longo de todo o dia. São perfeitas para us"
"4ftJF00UcO","Blusa Manga Longa Feminina moda fitness modeladora  yoga casaco academia proteção","44.47","44.47","0%","4.3","2992","1479","true","https://shopee.com.br/product/1553079968/58253492412","*Jaqueta Feminina Fitness com Zíper Jaqueta feminina com modelagem ajustada, confortável e moderna, ideal para treinos ou uso diário. Confeccionada em tecido elástico, leve e respirável, garante liberdade de movimentos e ótimo caimento. Possui zíper frontal, mangas longas e acabamento de alta qualidade. 📏 Tamanhos: P, M e G 🎨 Cores: Preto, Branco, Cinza e Rosé ✔️ Estilosa, confortável e prática ✔️ Não desbota e não perde a forma ✔️ Perfeita para academia e looks casuais 📦 Envio rápido | Quali"
"4qCjRIzrHR","Kit 2 Spray Capilar Banho Brilhante Efeito Gloss Sela a Cutícula 200ml CADA","19.90","49.99","60%","4.7","4390","50864","false","https://shopee.com.br/product/321104773/21999234823","Nós da Realce_Beaute temos o compromisso de ajudar os nossos clientes a enxergar a beleza que já existe, vamos realçar sua beleza hoje? Confira essa  promoção maravilhosa, obrigado pela preferencia❤ Esse kit contem  2 Spray Capilar Banho Brilhante Efeito Gloss Sela a Cutícula 200ml SPRAY BANHO BRILHANTE EFEITO GLOSS É um produto multifuncional desenvolvido para manter os cabelos macios hidratados e livre do Frizz sua fórmula possui agentes nutritivos que são absorvidos pelos cabelos que desembar"
"50W9dbzDwU","Jaqueta Masculina Casaco Lã Blusa De Frio Inverno Tricô Com Bolsos","69.23","89.90","23%","4.8","4467","319002","true","https://shopee.com.br/product/1567174664/23994206734","Casaco Masculino Com Zíper, Bolsos e costura de alta qualidade. DETALHES: **Trabalhamos Com o Melhor Tecido Do Mercado. **Tecido De Toque Macio e Confortável. **Não Junta Bolinhas. **Trabalhamos Com o Melhor Zíper. **Disponível em Diversas Cores e tamanhos. **Design Moderno: O design moderno e sofisticado torna esta blusa perfeita para qualquer ocasião, seja um encontro casual ou um evento mais formal. ======================================== ENVIO: **ENVIADO IMEDIATAMENTE APÓS A COMPRA SER REAL"
"5ApZpuyabX","KIT DE MEIA FEMININA BRANCA FOFO COM TEXTURA ALGODAO POLIESTER 35-40 IDEAL PARA PRESENTE E USO","14.99","14.99","0%","4.9","32909","13223","true","https://shopee.com.br/product/390229041/21298731450","TAMANHO 35-40 KIT COM 3 , 6 OU 12 PARES . MEIAS PARA MULHER EM POLIESTER , ELASTANO COM UM TRABALHADO PERFURADO, . IDEAL PRA PRESENTE E USO DIARIO . CONFORTAVEL E LINDA . NAO TEM COMO ESCOLHER OS DESENHOS, KIT VEM PACOTE FECHADO E DESENHO SORTIDOS . CADA ESTAMPA TEM UMA TEXTURA DIFERENTE Envie a cor aleatoriamente, porque o kit está fechado,"
"2g8ErK86g4","Kit Pares de Meias Infantil Masculino Bebê Menino Antiderrapante com Estampas Divertidas","16.99","22.99","26%","4.8","37118","85011","false","https://shopee.com.br/product/423397470/20899597332","Kit 12 Pares de Meias Infantil Masculino Bebê Menino Antiderrapante com Estampas Divertidas *Atenção  - Escolher a quantidade de Pares nas variações  - Cores e estampas variadas conforme estoque Composição 55 % Poliéster 43 % Algodão 2 % Elastano Ótima Qualidade Meias leves e macias com estampas divertidas e coloridas,  ótima para o dia a dia, escolar e passeio Tamanhos 0 a 6 Meses = RN (Antiderrapante) 0 a 12 Meses = Tamanho 13cm x 6 cm (Antiderrapante) 6 a 12 Meses = Tamanho 13cm x 6 cm (Antid"
"2qRf3d7TL7","E6S Cor Preta Fones De Ouvido Sem Fio TWS Bluetooth Com Microfone Estéreo Som Cancelamento Ruído LED Display Digital Fon","14.28","28.00","49%","4.8","98608","1313","true","https://shopee.com.br/product/1006215031/29379017291","Características: 1. Ferro móvel HIFI de frequência total - Experimente a qualidade de som superior com nossa tecnologia avançada de ferro móvel HIFI de frequência total, entregando áudio nítido e claro em todas as faixas. 2. Exibição Digital LED LED LED em tempo real - Mantenha-se informado com o display de energia em tempo real, permitindo monitorar facilmente o nível da bateria em um relance. 3. Uso Independente da Orelha - Os fones de ouvido esquerdo e direito podem ser usados separadamente, "
