slug,nome,preco,preco_original,desconto_pct,avaliacao,vendidos,estoque,tem_video,url,descricao
"902IOxjzpv","BODY SPLASH MASCULINO BARBARIUS 200ML - PRIMACIAL PERFUME AMADEIRADO","28.45","69.90","59%","4.7","30050","4054","true","https://shopee.com.br/product/1295467768/22894246754","Body Man Barbarius 200ml Perfume Masculino Marcante e Viciante Um dos body splashes masculinos mais vendidos e elogiados. O Body Man Barbarius entrega aquele cheiro de homem limpo, confiante e extremamente atraente, combinando frescor com intensidade na medida certa. É o tipo de fragrância que chama atenção, rende elogios e faz você se destacar em qualquer ambiente. A abertura traz um frescor cítrico e energizante que transmite sensação imediata de limpeza e presença. No coração, notas aromática"
"6pxnoysFEW","Chinelo Nuvem Tradicional Unissex Macio e Cofortável","5.89","30.00","80%","4.5","14582","6160","false","https://shopee.com.br/product/912462405/22492632177","📌O Chinelo Nuvem possui design despojado e versatilidade para combinar em diversas ocasiões. O modelo é confeccionado em Micro expandido, gerando maior conforto durante o calçar e caminhar. Confortável e prático possui cores maravilhosas e modernas para você usar em qualquer look. Do preto básico às cores da moda. Indicado para: Dia a Dia. Estilo da Peça: Lisa. Ocasião: Conforto. Modelo Antiderrapante. Temporada de lançamento: Primavera-verão. Garantia do Fabricante: Contra defeitos de fabricaç"
"6feNcfssZV","Camisola Renda Feminina Pijama Sexy Sensual Lingerie Conforto Linha Noite sem Bojo","16.99","39.98","58%","4.8","8450","909038","true","https://shopee.com.br/product/1234355161/22294382057","Linda camisola confeccionada em microfibra de poliéster, o busto é todo em renda forrado com o mesmo tecido. O detalhe da faixa em renda na parte inferior do busto, trás toda a sensualidade e elegância da peça. Modelo ideal para uma noite de sono confortável... TAMANHOS: M - veste quadril 36/38 e busto 40/42 G - veste quadril 40/42 e busto 44/46 GG - veste quadril 42/44 e busto 46/48 COMPOSIÇÃO: Tecido: 90% poliéster e 10% elastano Renda: 87% poliamida e 10% elastano INFORMAÇÕES IMPORTANTES: - O"
"7AaeDaqyYc","TOYADENTEscova Dental TOYADENT Ultra Soft, Kit 3 Unidades, 5500+ Cerdas, Cores Vibrantes","17.90","49.90","64%","4.9","15935","145134","true","https://shopee.com.br/product/1605400328/22694645105","Bem-vindo à nossa loja      TOYADENT  é uma marca especializada em produtos de saúde bucal, dedicada a oferecer às famílias brasileiras produtos de alta qualidade, seguros e inovadores, promovendo mais saúde e bem-estar para todos. Todos os produtos de higiene oral da marca (incluindo a linha MOMODENT) são certificados pela ANVISA (Agência Nacional de Vigilância Sanitária), atendendo aos mais altos padrões de segurança e qualidade exigidos pelo Brasil. Nossa missão é cuidar do seu sorriso e da s"
"70HE1Hrbtb","Calça Pantalona Feminina Tecido texturado Calça Feminino Cintura Alta Pantalona Elegante","39.99","59.99","33%","4.8","9994","5113","true","https://shopee.com.br/product/1277805925/23694913081","✨ Calça Pantalona Feminina Cintura Alta Canelada Calça elegante e confortável, com modelagem soltinha que valoriza o corpo e alonga a silhueta. ✔️ Cintura alta ✔️ Tecido canelado ✔️ Caimento leve e confortável ✔️ Ideal para looks casuais e elegantes 📏 Tamanhos: P (34-36) M (38-40) G (42-44) GG (44) "
"7VDUcCphsi","Meia Calça Feminina Plus Size Térmica Grossa Super Elástica Translucida Super Stretch De Inverna","23.98","78.00","69%","4.7","11035","7707","true","https://shopee.com.br/product/1366709144/47757324104","🛒Estamos todos em estoque, enviados no mesmo dia antes das 16:00 todas as tardes, envio rápido 24H.👑 －－－－－－－－－－－－－－－－－－－－－－－－－－－－－－－ 💎Descrição do Produto: ✨Meia Calça Feminina Plus Size – Conforto e Estilo para o seu Dia a Dia! ✨  ♥-Apresentamos a meia-calça perfeita para você que busca conforto, durabilidade e um toque de elegância. Confeccionada com 92% poliéster e 8% spandex, esta meia-calça oferece super elasticidade e se adapta perfeitamente ao corpo, garantindo liberdade de movimento e"
"7Ku4PtqLDh","Recarga de Queratina Meu Liso Restauração Intensa 80g","10.20","13.00","22%","4.9","82623","488","false","https://shopee.com.br/product/616222685/23795569799","A Recarga de Queratina Restauração Intensa combate os 7 danos extremos: frizz, quebra, opacidade, elasticidade, ressecamento, pontas duplas e cabelos fragilizados.  INDICAÇÕES  Para quais tipos de cabelo?   Cabelos lisos e ondulados naturais, alisados ou relaxados.  Qual a indicação?  Cabelo danificado, opaco e quebradiço.  Pode usar a partir de quantos anos?  A partir de 12 anos.  ATIVOS  Quais os principais ativos?  Conta com a tecnologia Total Repair 360, formada por aminoácidos, creatina, bi"
"7pqL0ooRCo","Kit 2000 Peças Bolsa Elástico De Cabelo Feminino Descartável Multicolorido","4.99","20.00","75%","4.9","22178","39801","true","https://shopee.com.br/product/986450286/23693118990","Descrição do produto Tipo: faixa de cabelo elástico Gênero: Menina Material: borracha Tamanho: cerca de 1,5cm Existem dois tipos de embalagens Eles são 500 e 1000 respectivamente Elásticos 1 Kit tem 2000 Elásticos no total Você pode escolher qualquer cor 😊 Postagem em até 24hs após confirmação do pagamento. Estamos a disposição para qualquer dúvida com um atendimento rápido e eficiente, das 8 as 17hs de Segunda a Sábado. Trabalhamos com o sistema de troca garantida, 🥰"
"7fWuoVp4Xn","Luminária Solar Parede 21W LED Controle Remoto De Jardim À Prova D'água Indução Automática","24.89","44.99","45%","4.7","12878","25332","true","https://shopee.com.br/product/1384675821/22998640234","A Luminária Solar de Rua 21W LED é ideal para quem busca uma iluminação externa potente, econômica e sustentável. Com sensor de presença, painel solar embutido e controle remoto, ela oferece praticidade e segurança para diversos ambientes. Destaques do Produto: 💡 Super Brilhante: LED de alta potência com iluminação forte e ampla. ☀️ Energia Solar: Funciona sem fios, alimentada pela luz do sol. 🌧️ À Prova D'Água (IP65): Resistente à chuva e ao tempo. 📡 Controle Remoto: Ajuste os modos de uso à"
"5VSQEWxJwO","Moedor Elétrico Café Grãos Inox 150W Multifuncional 110V 220V Compacto Potente Profissional","41.99","65.99","36%","4.8","1004","458","true","https://shopee.com.br/product/1619784139/58209332437","Moedor Elétrico Café Grãos Inox 150W Multifuncional 110V 220V Compacto Potente Profissional MOEDOR ELÉTRICO DE CAFÉ E GRÃOS INOX – ALTA PERFORMANCE E PRECISÃO Tenha o sabor e aroma do café fresco todos os dias com um moedor potente, compacto e extremamente eficiente. Ideal para quem busca praticidade, qualidade e resultado profissional em casa. Transforme grãos inteiros em pó fresco em segundos e eleve o nível do seu café e receitas. ✨ DIFERENCIAIS QUE VENDEM ✔ Lâminas afiadas em aço inox Moagem"
"5L902DxxHN","Cobertor Casal 200x180 Antialérgico Estampado e Cor Lisa - Toque Macio - Manta Casal Sortido","28.90","74.90","61%","4.3","33996","25693","true","https://shopee.com.br/product/296363855/23492848273","ENVIAMOS CORES SORTIDAS, POR FAVOR PRESTAR ATENÇÃO PARA EVITAR TRANSTORNO! ⚠️ NÃO INSISTA POR FAVOR POIS NÃO HÁ OPÇÃO DE ESCOLHA ⚠️ CORES ENVIADAS SORTIDAS. ⚠️                                                                       ********ENVIO APENAS SORTIDO*********                                                                       ******** IMAGENS ILUSTRATIVAS ********* Procurando por um cobertor manta casal que ofereça conforto, estilo e qualidade exclusiva? Apresentamos o nosso incrível c"
"5q5Gd8w3GU","Meia-Calça Térmica Forrado Grosso Translúcido Leggings De Lã Quente Das Mulheres De Winte","15.99","100.00","84%","4.8","3024","145859","true","https://shopee.com.br/product/1161906393/22597557781"," Nossa meia calça térmica translúcida é a solução perfeita para os dias frios de inverno. Feita com materiais de alta qualidade, ela é forrada com pelúcia super quente que mantém as pernas aquecidas e confortáveis. Sua transparência permite que você use com qualquer tipo de roupa, deixando suas pernas lindas e elegantes. Com um tamanho único e superestimulante, essa meia calça termica se adapta a qualquer tipo de corpo e ainda modela perfeitamente suas curvas. Além disso, é super confortável de "
"5flqQpwgbT","Blusa de frio do brasil moletom canguru torcedor brasileiro masculino e feminino unissex blusa com capuz e bolso","68.99","79.90","14%","4.7","58","23928","false","https://shopee.com.br/product/1224529773/22494928254","MOLETOM CANGURU PREMIUM – ESTILO E CONFORTO QUE SE DESTACAM!  Se você procura um moletom bonito, confortável e durável, acabou de encontrar! Produzido com tecido flanelado de alta qualidade (50% algodão + 50% poliéster), ele é super macio por dentro, quentinho na medida certa e perfeito para o dia a dia.  Destaques que fazem a diferença: Capuz ajustável para mais estilo e proteção Bolso canguru prático e funcional Modelagem moderna que veste muito bem Interior flanelado (mais conforto e aconcheg"
"6Ai71kumaa","Sandália Babuche Adulto Feminino  Nuvem com 8 Bottons aleatórios","32.90","33.99","3%","4.8","57475","9998","true","https://shopee.com.br/product/1234356004/23294049109","!!!!!!FORMA GRANDE!!!!!!! 8 BOTTONS/APLIQUES ALEATÓRIOS Surpreenda-se com um mimo extra pensado especialmente para o seu conforto – só por tempo limitado! 👟✨ Sinta o verdadeiro conforto com muito estilo! ✨👟 A Babuche Scaleno Nuvem Feminino Luxo com Bottons Personalizados é a escolha perfeita para mulheres que não abrem mão de praticidade, leveza e aquele toque fashion no dia a dia. Com um design moderno e detalhes encantadores, ela vai do básico ao descolado em segundos — tudo com muito confor"
"60OgpRvPvZ","Kit Lençol Fronha Estampada Cama Solteiro Casal Queen King 400 fios Micropercal 03 Peças Ponto Palito","36.09","47.90","25%","4.7","2256","34904","false","https://shopee.com.br/product/289796446/49859716861","O Lençol de Micropercal 400 fios é um produto de excelente qualidade, extremamente macio e aconchegante. Nosso produto possui um toque acetinado que traz muita maciez um toque a mais de sofisticação para o seu quarto.  As imagens são ilustrativas. IMPORTANTE: Antes de finalizar a compra, verifique com atenção a variação escolhida (cor/estampa, lençol solteiro, casal etc.), pois cada item possui um valor diferente. Em caso de dúvidas, estamos à disposição no chat! TAMANHO SOLTEIRO Nosso produto C"
"6VKxQMtVug","Película Cerâmica 9D 3D iPhone Gel Hidrogel Flexível película iphone 13 11 12 14 15 16 PRO MAX","4.98","10.00","50%","4.7","47551","31141","true","https://shopee.com.br/product/1024858829/22998660344","Película Cerâmica Flexivel 3D iPhone Todos os modelos mais recentes Atacado Oferta  Com este modelo de película diferente da tradicional ela cobre toda a parte frontal aparelho inclusive a borda garantindo assim melhor segurança do seu iPhone. O protetor de tela é o Full Glue, que possui um adesivo forte que facilita a instalação e prende o filme com firmeza para não afetar a sensibilidade da tela de toque; - Fácil de aplicação. - Modelo cobre toda tela. - Anti arranhão. - Alta sensibilidade. - "
"6L1XE3u9Ff","Kit Feira Cronolola Bemdita Ghee 100g Nutrição Hidratação e Reconstrução","28.49","54.99","48%","4.9","17892","4871","true","https://shopee.com.br/product/1263364177/20198000747","Kit Feira Cronolola Bemdita Ghee 100g Nutrição Hidratação e Reconstrução   Kit Feira Cronolola Lola Cosmetics   Descrição:Banana - não sou uma máscara comum mas sim uma ghee.Sou uma manteiga de frutas vegana, vegetal e orgânica, para tratamento capilar.Sou feita com água de coco, conhecida por ser muito rica em aminoácidos, e isso me faz muito melhor! minha textura já está perfeita para aplicação nos cabelos, não há necessidade de me aquecer.Ah, e embora o meu nome de manteiga, eu não sou comest"
"4Ax2e52OeG","calças fler com bolso tecido grosso 38/40/42/44/46/48/50/52/54","29.49","29.99","2%","4.7","13882","718721","true","https://shopee.com.br/product/1314293823/22094032770","muito eslastano não dar bolinha  não desbota tecido suplex"
"40dcRm31zF","Touca de cetim com Faixa Cor Rosa– Touca de Dormir Antifrizz  | Fabricante","9.98","18.00","45%","4.7","7275","42218","false","https://shopee.com.br/product/1455490500/58204730158","Conteúdo  - 1unidade Touca de Cetim Antifrizz (cor a escolher)   Touca de cetim diametro: 27-28cm   Fiaxa diametro:6cm Cuide dos seus cabelos com estilo, conforto e praticidade! O Capilar de Cetim é a combinação perfeita para quem deseja cabelos protegidos, hidratados e sempre bonitos. A Touca de Cetim Antifrizz, disponível em várias cores, mantém os fios livres de frizz durante o sono Touca de Cetim Antifrizz (Cores Variadas): Reduz o atrito com o travesseiro, evitando frizz e pontas duplas. Ma"
"4VZt2h17yM","Percarbonato 100% Puro Tira Manchas Roupas Brancas e Coloridas","17.99","31.99","44%","4.9","38673","264491","false","https://shopee.com.br/product/761647073/58256439593","Percarbonato 100% Puro Tira Manchas Roupas Brancas e Coloridas **ENVIO EM ATE 24H APÓS A CONFIRMAÇÃO DO PAGAMENTO** **SELECIONAR NA VARIACAO A QUANTIDADE DESEJADA** Percarbonato - Calisul O Que é o Percarbonato? - O percarbonato é um composto que quando dissolvido em água morna, ele se decompõe, liberando oxigênio ativo que age como um agente de limpeza potente. Esse oxigênio ajuda a quebrar as moléculas das manchas, tornando-as mais fáceis de remover. Vantagens: - Versátil - Eficiente e Poderos"
"4LGSqO1lJL","Kit Feminino Cropped Eu Não Tenho Tamanho Shorts Cor Sortida Aleatória","24.95","49.90","50%","4.8","6371","2001","false","https://shopee.com.br/product/832702330/22593967188","Conjunto Cropped + Shorts Cor Aleatória O Kit com cropped mais fofo que você já viu por aqui. Malha de qualidade, não pega bolinha, não precisa passar e ainda é megaaaa confortável. Estampa: Sublimação (não sai na lavagem). Tamanho do Pijama: P: Veste 34-36 M: Veste 38 G: Veste 40-42 GG: Veste 44-46 Comprimento do Cropped 21cm Tamanho Padrão: Indicamos a numeração de costume, por exemplo se você usa P Opte pelo Tamanho P. Lembrando que o shorts vai sortido conforme disponibilidade em estoque, nã"
"4qCjRIzrIS","Kit 100 Presilhas de Cabelo Estrela Coloridas Estilo Y2K Dopamina / Antiderrapantes Para Meninas","12.99","26.99","52%","4.9","5672","39682","false","https://shopee.com.br/product/1713632798/58252935781","## Descrição do Produto **Kit com 100 presilhas de cabelo em formato de estrela**, perfeitas para quem busca um visual moderno, divertido e versátil. Com design inspirado no **estilo coreano** e na tendência **Y2K**, essas presilhas adicionam um toque delicado e estiloso aos penteados do dia a dia. Produzidas em **metal de qualidade**, oferecem boa fixação, segurança e uma sensação premium ao toque. São ideais tanto para **uso diário** quanto para **festas e ocasiões especiais**. --- ## Detalhes"
"5ApZpuyacY","Percarbonato de Sódio 100% Puro Tira Manchas Roupas Brancas e Coloridas Limpeza em Geral","17.99","31.99","44%","4.9","13555","256431","false","https://shopee.com.br/product/967211054/23299372913","Percarbonato 100% Puro Tira Manchas Roupas Brancas e Coloridas **ENVIO EM ATE 24H APÓS A CONFIRMAÇÃO DO PAGAMENTO** **SELECIONAR NA VARIACAO A QUANTIDADE DESEJADA** Percarbonato - Calisul O Que é o Percarbonato? - O percarbonato é um composto que quando dissolvido em água morna, ele se decompõe, liberando oxigênio ativo que age como um agente de limpeza potente. Esse oxigênio ajuda a quebrar as moléculas das manchas, tornando-as mais fáceis de remover. Vantagens: - Versátil - Eficiente e Poderos"
"50W9dbzDxX","Meia Calça Leggig Flanelada Termica Cintura Alta Adulta Tamanho Unico","17.95","43.00","58%","4.6","42121","90075","false","https://shopee.com.br/product/437061636/19096967339","MEIA CALÇA SEGUNDA PELE TÉRMICA IDEAL PARA O INVERNO FLANELADO COM ELASTANO QUE DÁ FLEXIBILIDADE E CONFORTO FELPADA Composição: 95% poliéster, 5% elastano"
"4Ax3GKm307","Vestido Feminino Brasil Copa 2026 Bandeira Frente Única Torcedora","59.90","69.90","14%","4.8","84","238145","true","https://shopee.com.br/product/1501144405/23194950027","💚 POR QUE VOCÊ VAI SE APAIXONAR? 💛 Modelagem Assimétrica (Mullet): O charme do corte mais curto na frente, trazendo muito movimento e elegância. Ajuste Perfeito: Modelo frente única com cordinhas para amarração, permitindo que você regule no pescoço e na cintura como preferir. Estampa Exclusiva: Cores vibrantes que não desbotam, com os detalhes clássicos da nossa bandeira. Super Fresquinho: Tecido leve, perfeito para os dias mais quentes e para pular muito na hora do gol! 📏 GUIA DE TAMANHOS ("
"50WAFrisJI","Camiseta Personalizada do Brasil Blusa Feminina e Masculina 100% Algodão","34.91","75.90","54%","4.9","55","9921","false","https://shopee.com.br/product/464590540/58209590119","** ATENÇÃO PEDIMOS QUE APÓS A FINALIZAÇÃO DA COMPRA ENVIE O MAIS RÁPIDO POSSIVEL O NOME PERSONALIZADO , CASO NÃO SEJA ENVIADO A PEÇA SERÁ ENVIADA SEM PERSONALIZAÇÃO** CAMISETA DO BRASIL PERSONALIZADA 100% ALGODÃO PREMIUM - CONFORTO E ESTILO Descubra o conforto e a qualidade das nossas camisetas, produzidas com algodão 100% premium, proporcionando uma sensação macia e agradável na pele durante todo o dia. Nossa malha é respirável, ideal para dias quentes ou para te acompanhar na rotina de academi"
"5ApaSAiEyL","Cropped Moletom Moda Tendencia Femenina Blusa De Frio Brasil Copa Do Mundo 2026","78.79","145.90","46%","4.9","84","1458","false","https://shopee.com.br/product/1626133283/58208960692","🔥Cropped Moletom Moda Tendencia Femenina Blusa De Frio Brasil Copa Do Mundo 2026 🔥 🚨 LANÇAMENTO | ESTOQUE LIMITADO | SUCESSO DE VENDAS 🚨 💎 DESTAQUES QUE VENDEM: ✔Blusa com Zíper ✔  caimento perfeito ✔ Cores  da seleção Brasileira ✔ Tecido confortável e não transparente ✔ Modelagem que valoriza e afina a silhueta ✨ LOOK PRONTO EM SEGUNDOS!   Ideal para mulheres que querem praticidade sem abrir mão da elegância. 💃 PERFEITO PARA: Para torcida em dias de jogos Looks casuais chic Moda feminina "
"4ftJrFk8zG","Conjunto Body e Saia Brasil Copa – Moletinho com Elastano, Modelagem Ajustada e Confortável","55.00","100.00","45%","0.0","0","800000","false","https://shopee.com.br/product/1328679905/58255768158","Entre no clima da Copa com muito estilo usando o Conjunto Body e Saia Brasil Copa – Moletinho com Elastano, Modelagem Ajustada e Confortável 🇧🇷✨ Desenvolvido em moletinho com elastano, o conjunto oferece toque macio, excelente elasticidade e ajuste perfeito ao corpo, valorizando as curvas com conforto. O body possui modelagem moderna e firme ao corpo, enquanto a saia complementa o visual com caimento ajustado e estiloso. Ideal para dias de jogo, eventos esportivos, festas temáticas ou para mon"
"4qCk3YjVeJ","Jaqueta Feminina Lã Batida Premium Casaco Curto Inverno Chic 2026","69.99","89.99","22%","4.9","97","3671725","true","https://shopee.com.br/product/299582074/58259333831","𝐄𝐋𝐄𝐆𝐀̂𝐍𝐂𝐈𝐀 𝐄 𝐂𝐎𝐍𝐅𝐎𝐑𝐓𝐎 𝐏𝐀𝐑𝐀 𝐎 𝐒𝐄𝐔 𝐈𝐍𝐕𝐄𝐑𝐍𝐎! ❄️ A nossa Jaqueta em Lã Batida é a peça-chave que faltava no seu guarda-roupa. Com um corte moderno e estruturado, ela une o estilo casual do design bomber com a sofisticação da lã, garantindo um look impecável do trabalho ao happy hour. 😍𝐏𝐨𝐫 𝐪𝐮𝐞 𝐯𝐨𝐜𝐞̂ 𝐯𝐚𝐢 𝐚𝐦𝐚𝐫?😍 𝐓𝐄𝐂𝐈𝐃𝐎 𝐏𝐑𝐄𝐌𝐈𝐔𝐌: Lã batida de alta qualidade, macia ao toque e super quentinha. 𝐂𝐀𝐈𝐌𝐄𝐍𝐓𝐎 𝐏𝐄𝐑𝐅𝐄𝐈𝐓𝐎: Design acintur"
"30l5sBqUMy","Cropped Top Feminino Personalizado Copa 2026 ESTHER BRAZIL","29.94","49.90","40%","4.8","1360","951","true","https://shopee.com.br/product/587578299/23598568886","*Após o fechamento do pedido, a plataforma da Shopee não permite  alterações de cores, tamanhos e os endereços. O envio é feito automaticamente da forma exata que está no pedido* . Top Esther confeccionado em Suplex , possui modelagem que proporciona muito conforto e elasticidade na medida certa, Pode compor um look para seus treinos ou no dia a dia. Tecido: Suplex • Modelo veste M • Sem Bojo • Forrado • Composição: 92% Poliéster 08% Elastano Instruções complementares: • Lavar a mão com temperat"
"3B4W4Upr21","Saia Festa Junina São João Arraiá Quadrilha Caipira Curta Juvenil Adulta Rodada Xadrez","99.90","229.90","57%","4.9","245","280","false","https://shopee.com.br/product/1340072116/22898461699","PRODUTO A PRONTA ENTREGA! ENVIO IMEDIATO! Suspensório ajustável Material: 50% Poliéster, 50% algodão Variações:  Vermelha Florida, Azul Florida, Preta Florida, Xadrez Preto, Xadrez Vermelho, Xadrez Azul Celebre o verdadeiro espírito caipira do arraiá com a nossa encantadora saia rodada florida/xadrez em chita, perfeita para festas juninas e arraiás de tamanho adulto. Com suas estampas vibrantes e cheias de vida, essa saia traz toda a alegria e animação típicas das festividades. Seja a estrela da"
"2g8FTZrl2w","Kit 2 Camiseta Camisa Casal Brazil Frase Criativa Juntos na Copa Brasil Tendência Oferta","54.90","54.90","0%","4.7","21","18655","false","https://shopee.com.br/product/541804501/58207868279","Olá Seja bem vindo ! Apresentamos nosso Kit 2 Conjunto Casal com 2 Camiseta 100% Algodão com um corte amplo e folgado, essas peças foram fabricadas com materiais de alta qualidade, garantindo durabilidade excepcional. Detalhes do Conjunto - Modelo: Kit 2 Camiseta  - Tamanhos disponíveis: P, M, G, GG (Verifique a TABELA DE TAMANHOS ) - Estampa: DTF  - Detalhes da estampa: Possui textura levemente emborrachada, oferecendo alta durabilidade e resistência à lavagens.  Enviamos seu produto na mais rá"
"3g0mfPnx1A","Kit Camiseta Casal Brasil Nome Personalizado 100% Algodão Estampada Copa do Mundo","64.99","99.99","35%","4.8","137","1581816","true","https://shopee.com.br/product/1442787125/55259766596","✨ PERSONALIZAÇÃO: ✔️ Adicione o nome desejado ✔️ Personalização feita com alta qualidade e durabilidade ✔️ Ideal para uso individual, casal, amigos ou família 📌 Como personalizar: Nas observações da compra, envie o nome desejado.  Exemplo: Nome: Neymar. Número:10 Caso não envie, o produto será enviado sem nome nas costas 👕 Qualidade Premium: ✔️ 100% Algodão macio, respirável e confortável ✔️ Tecido encorpado (não fica transparente) ✔️ Modelagem moderna que valoriza o corpo sem apertar ✔️ Alta "
"3qKCrinJgD","Meias Estilo Primavera Para Pilates E fitness , Absorventes De Suor Respiráveis .","15.99","39.00","59%","5.0","75","16333","false","https://shopee.com.br/product/1399701658/52609416948","Nome do tecido: Algodão     Máquina de costura desossada: Não: cabeça de máquina de costura     Função: Absorção de suor     Fonte/Cor Ext combinando: Cor combinando para fontes/Números/Texto     Forma de embalagem: saco     Gênero aplicável aplicável: neutro / masculino e feminino     Faixa Etária aplicável: Juventude (18-40 anos)     Componente principal de tecido principal do tecido principal: algodão     Altura do tubo: Cano alto     Número de Agulhas: 200N     Tempo de lançamento no mercado"
"3LNwGnpDh8","Conjunto Brasil cropped Canelado e short. Estilo verão,copa do mundo 2026 vibe  looks do brasil","34.90","79.90","56%","4.6","693","764","true","https://shopee.com.br/product/594102844/58006470123","💛💚 Conjunto Brasil L’Olive – Edição Exclusiva 🇧🇷 A energia do Brasil com o estilo que só a L’Olive tem. Esse conjunto foi pensado para valorizar o corpo e destacar sua confiança. O cropped ajustado realça a silhueta, enquanto o short de cós alto com amarração frontal modela e garante conforto absoluto. ✨ Detalhes que fazem a diferença: Conjunto Shorts Veste do 36 ao 40 Conjunto Saia Veste do 36 ao 44 * Cropped com estampa “BRASIL” + bandeira * Short com acabamento contrastante * Modelagem qu"
"3VhMT6oaMB","Conjunto Moletom Feminino Abrigo Blusa e Calça de Frio Flanelado Canguru Capuz Inverno","119.00","159.00","25%","4.7","151","11940","true","https://shopee.com.br/product/1587733934/45658530663","Conjunto de Moletom Feminino Flanelado  Se você busca conforto, qualidade e estilo em um só look, esse conjunto é a escolha ideal!  Produzido em tecido de alta qualidade, ele possui acabamento flanelado internamente, proporcionando um toque macio e quentinho na pele — perfeito para dias mais frios sem abrir mão do estilo. >Blusa com capuz Modelagem soltinha e confortável Capuz com ajuste em cordão Estilo canguru com bolsos >Calça Cós com elástico e cordão para melhor ajuste ao corpo Modelagem mo"
"70HEdXbGFs","Blusa Feminina Brasil T-shirt Verão Algodão","31.96","79.90","60%","4.7","4433","17980985","true","https://shopee.com.br/product/681967866/41178806100","Camiseta Perfeita Para o Seu Dia a Dia Está Aqui! Descubra o conforto e o estilo que só uma Blusa 100% algodão premium pode oferecer. ✔️ Toque macio ✔️ Respirabilidade incomparável ✔️ Estilo que combina com tudo! Tabela de Medida : P - 71 cm de altura por 50 cm de largura M - 72 cm de altura por 52 cm de largura  G - 75 cm de altura por 55 cm de largura GG - 77 cm de altura por 59 cm de largura G1- 79 cm de altura por 64 cm de largura G2- 80 cm de altura por 67 cm de largura G3- 84 cm de altura "
