slug,nome,preco,preco_original,desconto_pct,avaliacao,vendidos,estoque,tem_video,url,descricao
"7Aaepqacuv","Adultos e Crianças Pijamas de Inverno de Flanela Quente Confortável, Design Animal,","55.00","110.00","50%","4.9","3859","96683","false","https://shopee.com.br/product/983645094/27951088537","  Pacote Incluso: 1 * Pijama Idade: 2-8 anos Tamanho: 100cm; 120cm; 140cm Tamanho da unidade de mesa da mesa: CM (1 CM = 0,39 polegadas) 100 cm de comprimento 100 cm: comprimento 85 altura adequada: 90-100 cm Idade recomendada: 2-3 anos 110 cm: Comprimento: 95 Altura adequada: 100-110 cm Idade recomendada: 3-4 anos 120cm: Comprimento: 105 Altura adequada: 110-120cm Idade recomendada: 4-5 anos 130cm: Comprimento: 115 Altura adequada: 120-130cm Idade recomendada: 5-6 anos 140cm: Comprimento: 125 A"
"6feOEvcWvq","Conjunto Zíper Listrado Inverno","70.00","70.00","0%","3.2","157","445","true","https://shopee.com.br/product/1551697817/23994269065","Conjunto Feminino Ziper Listrado, blusa de manga comprida com abertura frontal em ziper, calça em estilo pantalona, conjunto com bastante elasticidade, assim se ajustando ao corpo"
"6pxoREbtat","Casaco de Lã Batida Feminino 2026 Sobretudo Elegante Premium de Inverno luxoquentinho e Pelos Removivel COM CINTO 01 ads","215.28","299.00","28%","4.5","48","11885","true","https://shopee.com.br/product/705761751/23198661449","CASACO DE LÃ BARTIDA CASACO EM LÃ BATIDA, EXTREMAMENTE GROSSA E QUENTINHA. TODAS AS FOTOS SÃO REAIS, NÃO APRESENTAM NENHUMA ALTERAÇÃO. SÃO PERFEITAS, COM CERTEZA VOCÊ SÓ VAI ARREPENDER SE NÃO COMPRAR MAIS DE UMA. ENTÃO APROVEITE, E COMPRE DIRETO DA FONTE. SOMOS FABRICANTES E IMPORTADORES. SOMOS FORNECEDORES NACIONAL, ENTÃO VOCÊ VAI RECEBER RAPIDINHO!!! OBS: Você até pode encontrar mais barato, mas NÃO tem a mesma qualidade que a nossa, tenha certeza disso!!!! Aproveite!!! - Somos importadores de"
"7fWvQlYiu4","Camiseta Brasil Feminina Verde Torcida Estilosa Copa 2026 Algodão Premium Confortável","31.96","79.90","60%","4.9","110","7104918","true","https://shopee.com.br/product/681967866/52706391547","Camiseta Perfeita Para o Seu Dia a Dia Está Aqui! Descubra o conforto e o estilo que só uma Blusa 100% algodão premium pode oferecer. ✔️ Toque macio ✔️ Respirabilidade incomparável ✔️ Estilo que combina com tudo! Tabela de Medida : P - 71 cm de altura por 50 cm de largura M - 72 cm de altura por 52 cm de largura G - 75 cm de altura por 55 cm de largura GG - 77 cm de altura por 59 cm de largura G1- 79 cm de altura por 64 cm de largura G2- 80 cm de altura por 67 cm de largura G3- 84 cm de altura p"
"7pqLd4Y5Z7","Macacao Feminino Decotado Alcinha 2 Fendas Pantalona","49.99","49.99","0%","4.7","2203","11","true","https://shopee.com.br/product/824474412/23931899885","CUPOM EXCLUSIVO DESCONTOPARAVOCE , (MININO DO PEDIDO R$35,00) E VOCE GANHA R$5,O0 DE DESCONTO.  NÃO PERCA A PROMOÇÃO POR TEMPO LIMITADO.!!! Bem vindo a FÊNIX FRF Macacao Feminino Decotado Alcinha 2 Fendas Pantalona Tamanho Único:  veste aproxidamente do 36 ate 42  Garantia de satisfação: em caso de arrependimento, efetuamos a troca ou a devolução sem nenhuma burocracia, desde que a peça não tenha sido danificada, dentro das regras da shoppe . Qualquer dúvida ou sugestão estamos à disposição entr"
"7Ku529Zza2","Conjunto Ziper Inverno Pantalona","70.00","70.00","0%","3.5","83","51","true","https://shopee.com.br/product/1551697817/20698271319","Conjunto Feminino para o Inverno com calça estilo pantalona, blusa com abertura frontal em zíper, ideal para no trabalho ou numa festa, em momentos de lazer, vem em um tecido super confortável e tem um ótima elasticidade."
"7VDVESZMF5","Bady Doll Pijama Personagens Estampado Suede Com Detalhe de Renda Roupa de Dormir Top Doll","19.90","34.90","43%","4.9","20659","1070","true","https://shopee.com.br/product/542438037/21798141466","IMPORTANTE: Leia atentamente toda a Descrição e, caso ainda tenha alguma dúvida, fique a vontade para entrar em contato com o nosso CHAT.  CARACTERÍSTICAS DO PRODUTO:  - Pode escolher o tamanho e a estampa - Vídeos e fotos autorais da nossa empresa (VOCÊ RECEBE EXATAMENTE O PRODUTO QUE ESTÁ NAS FOTOS E NOS VÍDEOS DO ANUNCIO) - Tecido macio e confortável Estampa Animal Print ou Personagens da moda - Detalhe de renda no top - Não possui fechos, regulagens, botões, aro... GARANTIA DE CONFORTO NO SE"
"5flr35gKxk","Blusa Feminina T-shirt Brasil com S 100% Algodão Premium Envio Imediato","29.67","68.99","57%","4.5","254","37537486","true","https://shopee.com.br/product/681967866/54958027125","Camiseta Perfeita Para o Seu Dia a Dia Está Aqui! Descubra o conforto e o estilo que só uma Blusa 100% algodão premium pode oferecer. ✔️ Toque macio ✔️ Respirabilidade incomparável ✔️ Estilo que combina com tudo! 🕒 COMPROU ATÉ AS 11H? ENVIAMOS NO MESMO DIA! Não perca tempo — receba em casa com rapidez! Tabela de Medida : P - 71 cm de altura por 50 cm de largura M - 72 cm de altura por 52 cm de largura G - 75 cm de altura por 55 cm de largura GG - 77 cm de altura por 59 cm de largura G1- 79 cm d"
"5q5HFOfhcn","Saia Xadrez Feminino Curta De Inverno e Festa Junina Com Costura Reforçada Estilosa Do 36 ao 44","29.90","77.89","62%","4.5","81","192","true","https://shopee.com.br/product/1124636121/46607981788","⏰ ENVIO RÁPIDO: pedidos aprovados até 12h são enviados no mesmo dia! ✨ Saia Xadrez Curta Feminina com Fenda Frontal ✨ Estilo, elegância e conforto em uma peça só! A saia xadrez curta é perfeita para quem busca um visual moderno e sofisticado sem abrir mão do conforto. Sua modelagem ajustada valoriza a silhueta, enquanto a estampa xadrez clássica traz charme atemporal. A fenda frontal discreta adiciona um toque moderno e feminino na medida certa. 💎 Fabricação própria Peça produzida com cuidado, "
"5L90eThbdi","Conjunto Feminino Inverno Plush. Tamanhos: P ao Plus Size - Com zíper, capuz e bolso. Agasalho quentinho, liso e básico","116.99","139.99","16%","4.8","1783","125","true","https://shopee.com.br/product/369623161/16829247820","Conjunto Feminino Plush Feminino Garantimos a melhor qualidade 😍 P(36) M(38) G(40) GG(42) G1(44/46) G2(48) G3(50/52) Tecido possui bastante elástano. Veste super bem e é muito confortável!! SE PREFERE MAIS SOLTINHO PODE COMPRAR UM TAMANHO MAIOR Calça com elástico na cintura Sem punho na barra. Bolsos na calça e na blusa Possui capuz. *Tamanho P* Busto 50cm Braço 60cm Quadril 42cm Perna 105cm *Tamanho M* Busto 52cm Braço 60 cm Quadril 45cm Perna 106cm *Tamanho G* Busto 55cm Braço 60cm Quadril 50"
"5VSQqmgyIl","Joyjoy Conjunto de Pijamas de Seda Alta para Mulheres – Verão e Outono, Manga Longa, Conforto e Elegância plus size","28.99","120.57","76%","4.1","79","47887","true","https://shopee.com.br/product/979558874/24844165608","Olá, meu querido amigo. Bem-vindo à nossa loja JOYJOY!Esperamos sinceramente que você goste de todos os produtos em nossa loja e forneça o melhor serviço. Nome Comum do Tecido: Seda Gelo. Material do tecido principal: Fibra de Viscose. Conteúdo ingrediente: 91% (Inclusivo) -95% (Inclusivo) Espessura fina: Seção fina Gênero aplicável: feminino. Estilo Homewear: Doze Comprimento da manga comprida: Manga comprida Idade aplicável: Juventude (18-25 anos) Detalhes do estilo de roupa: Impressão. Tipo d"
"6L1XqJdnbw","Blusa Feminina Brasil South America T-shirt Verão Manga Curta Envio Imediato","38.00","69.90","46%","5.0","1","23865462","false","https://shopee.com.br/product/681967866/57657873051","Camiseta Perfeita Para o Seu Dia a Dia Está Aqui! Descubra o conforto e o estilo que só uma Blusa 100% algodão premium pode oferecer. ✔️ Toque macio ✔️ Respirabilidade incomparável ✔️ Estilo que combina com tudo! 🕒 COMPROU ATÉ AS 11H? ENVIAMOS NO MESMO DIA! Não perca tempo — receba em casa com rapidez! Tabela de Medida : P - 71 cm de altura por 50 cm de largura M - 72 cm de altura por 52 cm de largura G - 75 cm de altura por 55 cm de largura GG - 77 cm de altura por 59 cm de largura G1- 79 cm d"
"6VKy2cdAGz","Casaco Teddy Feminino Pelúcia Tipo Pele de Carneiro Inverno Quentinho Macio Casual","89.90","89.90","0%","4.7","1589","87932","false","https://shopee.com.br/product/1086519436/23197452801","🧥 Casaco Teddy Feminino Peluciado Tipo Pele de Carneiro – Super Quentinho para Inverno Se você busca conforto, estilo e muito calor nos dias frios, o casaco teddy feminino é a escolha perfeita! Produzido com tecido peluciado tipo pele de carneiro, ele é extremamente macio, aconchegante e quentinho, ideal para o inverno. ✨ Destaques do Produto: ✔ Material peluciado de alta qualidade (efeito pele de carneiro) ✔ Super quentinho e confortável para dias frios ✔ Toque macio e agradável na pele ✔ Mode"
"60OhRhf4Hu","Conjunto Feminino Lanzinha Inverno Blusa Cropped e Saia Midi com Fendas Laterais","59.90","59.90","0%","4.7","1041","35815","true","https://shopee.com.br/product/1228604047/23898408578","SEJA BEM VINDA A NOSSA LOJA A&L  __ NOVIDADE DE INVERNO CONJUNTO FEMININO LANZINHA QUENTINHO.  PREZAMOS PELO CONFORTO E QUALIDADE PARA NOSSOS CLIENTES, SOMOS FABRICANTES PROPRIOS  BLUSA CROPPED E SAIA MIDI COM FENDAS LATERAIS TAMANHO: P-M-G-GG TECIDO: LÃNZINHA CONTÉM ELASTICIDADE ( ESTICA BEM ) TAMANHO: P 36/38 M 38/40 G 42/44 GG 44/46 >>>> QUALQUER DUVIDA ESTAMOS A DISPOSIÇÃO <<<<  BOAS COMPRAS!"
"6Ai7e0eQwx","Anime Dos Desenhos Animados Charlie Brown Conjunto de Pijamas Snoopy Mulheres Novo Verão INS Shorts de Manga Curta ","28.99","49.71","42%","4.6","133","33468","false","https://shopee.com.br/product/1104180297/26107655539","Olá, querido amigo Bem-vindo à nossa loja Joyjoy! Espero que você possa gostar de todos os produtos em nossa loja e fornecer-lhe de todo o coração os melhores produtos e serviços. Verão New INS Coreano Verão Anime Dos Desenhos Animados Brown Print Snoopy Pijama Set Shorts de Manga Curta Roupas Exteriores Padrão Kawaii Estudante Terno Doméstico 🎉🎉Boa vinda para comprar nossos produtos, após ter recebido a satisfação dos bens, deixa por favor uma boa avaliação tous. Características do produto: T"
"9fHzoRR6qe","Blusa Feminina Cores Brasil Brasão Copa Do Mundo Gola Redonda Manga Curta Baby Look Poliamida","26.90","54.90","51%","4.7","332","387","true","https://shopee.com.br/product/603782959/50007702992","A blusa feminina Cores Brasil Copa do Mundo é a escolha perfeita para quem deseja expressar seu amor pelo futebol com estilo. Com um design casual e cores vibrantes que representam a bandeira do Brasil, esta peça é ideal para torcer pelo seu time durante os jogos ou para um passeio descontraído. Confeccionada em uma mistura de algodão e poliéster, a blusa oferece conforto e leveza, perfeita para os dias quentes da primavera e verão. Seu caimento reto e a gola redonda garantem um ajuste confortáv"
"9pbQ0kQTVh","Calça Legging Termica Flanelada Peluciada Cós Alto Leg Feminina","38.99","110.00","65%","4.6","1188","88058","false","https://shopee.com.br/product/1025213096/24898131886","Calça Legging Feminina Flanelada Peluciada Térmica Cós Alto A peça chave que une o máximo conforto térmico ao estilo que você precisa. Nossa Legging Flanelada é desenvolvida em  Tecido Suplex Felpado de Alta Gramatura , garantindo que você fique quentinha no inverno sem perder a mobilidade. POR QUE VOCÊ VAI AMAR? Forro Peluciado (Pelúcia Premium): Toque macio e aquecimento absoluto. Cós Alto e Duplo: Modela a cintura, oferece alta sustentação e não enrola. Zero Transparência: Tecido de alta dens"
"9Kf9PpSNWc","Camiseta Brasileira Feminina Infantil e Adulto T-shirt Tal Mãe Tal Filha Brasil Promoção","59.90","59.90","0%","4.9","425","959241","false","https://shopee.com.br/product/1316980618/52758437928","Leve o orgulho de ser brasileira com conforto e muito estilo! A Camiseta “Brasileira” da Vidotto Store foi criada para mulheres e meninas que amam representar o Brasil com elegância e personalidade. Com uma estampa delicada e moderna, ela é perfeita para criar looks inesquecíveis — principalmente no estilo “tal mãe, tal filha”. Vendidas separadamente, você pode selecionar a cor e o tamanho que preferir!  Para o Kit tal mãe e tal filha é necessário adicionar 2 unidades no carrinho. Ideal para o d"
"9UyZc8RkBf","Vestido Longo Feminino Alcinha Fina ,Costa Nua com Bojo ,Canelado Lisa , Fenda Lateral , Verão","43.73","59.90","27%","4.7","2291","3086","true","https://shopee.com.br/product/905229815/23292853843","""Vestido Longo Alça Fina: Glamour e Sensualidade! - Design costa nua com alças finas para um look ousado e elegante - Fenda lateral para um toque sensual e impactante - Com bojo para apoio e segurança - Tecido canelado: confortável, elástico e com caimento bonito TABELA DE MEDIDAS      Busto   -Quadril  - Comprim. P   74cm   - 74cm      -1.31 M  78cm   -78cm       -1.34 G  84 cm   -86cm      -1.34 Perfeito para ocasiões especiais, festas ou looks de gala! Compre agora e arrase!"" "
"AKXgbfOZUq","2 camisa do Brasil casal copa do mundo/ Kit casal 2 blusa do Brasil","149.00","149.00","0%","4.9","66","1639","true","https://shopee.com.br/product/880951566/22794806088","Kit 2 blusa  Blusa no tecido suede premium  Estampa exclusiva  Tamanhos  P 34/36 M 38/40 G 42/44 GG 46/48 XG Plus size "
"AUr6nyNw9t","Meia 3D Cano Alto Volta às Aulas - Meia Patty Algodão Premium Personagens Divertida para Crianças","19.90","39.80","50%","4.9","568","3199637","true","https://shopee.com.br/product/1483307846/28888735945","Bem-vindo à nossa loja! 😊😊😊    Recomendamos fortemente esta meia alta costura ponto super fofo.    Você não é atraído instantaneamente para suas orelhas 3D incrivelmente realistas? Não é apenas uma estampa plana! São tridimensionais e carnudos, com textura que se sente como tocar nas orelhas. Eles são tão adoráveis, é como você está usando aquele ponto azul animado em suas pernas!    Não admira apenas como é fofo; esta meia é feita de algodão de alta qualidade. É macio e fofo, sentindo-se inc"
"9zuqD3PqAo","Conjunto Femenino Lanzinha Ribi canelada 2 Peças Blusa e Pantalona plus size","79.99","79.99","0%","4.9","16062","215","true","https://shopee.com.br/product/1196446677/23793877414","*Conjunto de Calça Pantalona e Blusa – Estilo e Conforto para Todas as Silhuetas* Apresentamos o nosso elegante conjunto de calça pantalona e blusa, perfeito para mulheres que buscam aliar estilo e conforto em um só look. Disponível em tamanhos normais (M/G) e plus size (GG e G2), este conjunto foi desenvolvido para valorizar suas curvas e proporcionar um caimento impecável. *Detalhes que encantam:* * *Tecido:* Confeccionado em malha lanzinha ribi, um tecido macio, leve e estica muito, ideal par"
"AAEGPMPCpr","Calça Wide Leg Jeans Feminina Cintura Alta Pantalona","64.99","99.90","35%","4.8","42910","261614","true","https://shopee.com.br/product/532620463/22197697652","⭐️-ENVIO IMEDIATO- ⭐️ ✅DESTAQUES  -❤️ Jeans 100% -❤️ Empina BumBum -❤️ Cós, Cintura Alta  -❤️ Modela Corpo ✅DESCRIÇÕES MODELO 100% ALGODÃO SEM LYCRA, SEM ELASTANO, SEM STRETCH. Benefícios: ✔️Modelagem usada em grandes marcas. ✔️Nosso tecido é o JEANS bem encorpado ✔️Não possui tingimento ( durabilidade muito maior) ✅PACOTE INCLUI  1X Calças Jeans  ✅NOTAS DE COMPRA  Por favor, consulte sua altura e a tabela de tamanhos antes de comprar. Há uma diferença de 2-3% de acordo com a medição manual. Tod"
"8KmcDzWBYW","Camiseta Feminina Preta 100% Algodão Academia Docinho Florzinha Lindinha Look Treino Confortavél","32.65","120.90","73%","4.9","1480","34497606","true","https://shopee.com.br/product/681967866/40007124196","Apresentamos a Camiseta de Algodão , um lançamento que combina estilo, conforto e versatilidade. Ideal para compor looks casuais e despojados, esta camiseta é feita com 100% algodão, proporcionando maciez e respirabilidade para o uso diário. **Características:** Material: 100% algodão, que garante conforto e durabilidade. Cor: Cores clássica que facilita combinações com diferentes peças. Estilo: Design moderno e estiloso, perfeito para homens que buscam um toque contemporâneo em seu vestuário. M"
"8V62QIVYDZ","Meia-calça térmica preta com forro peluciado –De Lã  quente para o inverno 2025,Feminina","29.60","56.90","48%","4.9","21075","11644","true","https://shopee.com.br/product/1499606732/23293957278"," Meia-calça térmica com toque sexy – Inverno 2025 com estilo e calor 💃 Sensual e quentinha Realce sua silhueta com elegância — a meia-calça ideal para quem ama moda até no frio! 🧸 Forro peluciado premium Interior super macio que abraça a pele, garantindo calor mesmo em temperaturas abaixo de zero. 👗 Fácil de combinar Use com vestidos, saias, suéteres ou botas — looks elegantes sem abrir mão do conforto. 📏 Disponível nos tamanhos: M (36–42) | L (42–48) Look casual chic para o dia: Meia-calça "
"809lpNXSEU","Conjunto Feminino Body e Saia do Brasil Blusa da Seleção Brasileira","49.98","99.98","50%","4.9","142","437","true","https://shopee.com.br/product/975780170/22399429963","Conjunto Feminino Body Cavado e Saia do Brasil Copa do Mundo Seleção Brasileira  2 peças separadas - 1 Body e 1 Saia Canelada Alta Elasticidade Tecido Acetinado Cores Vivas  👚 Tecido  Poliéster - 96% Elastano - 4% 📏 Tamanho Único (36 ao 44)"
"8ATC1gWotX","Shorts Tendencia Alfaiataria Com Cinto De Couro Modelo Social Short","23.50","50.00","53%","4.8","9692","117","true","https://shopee.com.br/product/1098585909/23992851334","Shorts de Alfaiataria com Cinto - Disponível em Várias Cores Este shorts de alfaiataria é perfeito para compor looks estilosos e confortáveis. Com bolsos práticos e diversas opções de cores, ele combina elegância e versatilidade para o dia a dia. Ideal para quem busca um visual moderno e sofisticado. Tamanhos e Recomendações de Peso: P: Indicado para quem pesa até 57 kg M: Indicado para quem pesa de 57 a 65 kg G: Indicado para quem pesa de 65 a 75 kg Modelagem ampla, proporcionando um caimento c"
"902J1DTeCi","Camiseta FemininaT-shirts Brasil Copa Camisa Roupa Blusinha Futebol Blusa Algodão","27.90","59.90","53%","4.8","172","212","false","https://shopee.com.br/product/1651851128/58259468957","👚 T-Shirt Feminina Muscle Brasil Copa | LP-SHIRTS 🇧🇷⚽ ✨ Estilo esportivo com atitude e conforto! A muscle tee perfeita para entrar no clima da Copa com muito estilo! Modelagem moderna, sem mangas, com caimento soltinho que valoriza o look e garante liberdade de movimento. 🇧🇷 Estampas exclusivas do Brasil Ideal para torcer com personalidade — cores vibrantes e artes inspiradas na Copa! 💯 Tecido 100% algodão Super macio, leve e resistente — conforto garantido o dia todo. 🏭 Somos fábrica Qua"
"9ALjDWT0rl","Kit 2 Peças Camisola + Pijama Baby Doll Feminino Sexy Lingerie Estampado Coração","32.99","74.99","56%","4.7","1215","19766","true","https://shopee.com.br/product/897545291/58204266757","💞 Kit 2 Conjuntos Camisola e Pijama Baby Doll Feminino Sexy Lingerie Estampa Coração Sinta-se linda, confortável e confiante com este kit completo com 2 conjuntos, contendo 1 camisola baby doll + 1 pijama baby doll feminino, ambos com estampa de corações e visual moderno estilo blogueirinha. Ideal para quem ama dormir bem sem abrir mão do charme e da sensualidade. 💋 ✨ Destaques do kit: Kit com 2 conjuntos femininos (camisola + pijama) Modelos baby doll leves, soltinhos e confortáveis Estampa d"
"8fPScbUusg","Lovito Vestido Boho sem costas vestido primavera/verão para mulheres LK3LD389","57.90","83.00","30%","5.0","185506","126","false","https://shopee.com.br/product/426378412/41528739305","✅DESTAQUES  -❤️Padrão -❤️Sem encosto -❤️Sensação de mão suave -❤️Primavera e verão ✅DESCRIÇÕES Estampa / Padrão:Tribal print Estilo:Boho Tipo de vestido:Uma Linha Tamanho Plus:No Material:Poliéster Composição:100%Polyester Tipo de modelagem:Regular Fit Transparência:No Esticar:Non-stretch Feito na China  ✅O PACOTE INCLUI 1XVestir ✅INTRODUÇÃO LOVITO A Lovito é uma marca em crescimento que acredita no poder das meninas. Estamos comprometidos em oferecer opções de roupas fashion e acessíveis, para "
"8pisouUHXj","Conjunto Brasil cropped e short. Estilo verão,copa do mundo 2026 vibe  looks do brasil","18.90","29.90","37%","4.6","1886","735","true","https://shopee.com.br/product/386803813/55156312780","💛💚 Conjunto Brasil L’Olive – Edição Exclusiva 🇧🇷 A energia do Brasil com o estilo que só a L’Olive tem. Esse conjunto foi pensado para valorizar o corpo e destacar sua confiança. O cropped ajustado realça a silhueta, enquanto o short de cós alto com amarração frontal modela e garante conforto absoluto. ✨ Detalhes que fazem a diferença: Veste do 34 ao 40 ATENÇÃO NA HORA DE SELECIONAR A VARIAÇÃO  APENAS CROPED SÓ VAI A BLUSA CONJUNTO VAI COM O SHORTS! * Cropped com estampa “BRASIL” + bandeira "
"1qZ8U2uvkO","Cropped Brasil Feminino Torcedora Copa Canelado Bordado Manga Curta Verde Amarelo Tendencia","29.95","59.90","50%","4.9","54","2086","true","https://shopee.com.br/product/1027899621/58206430216","Entre no clima da Copa com estilo. O cropped feminino Brasil é confeccionado em tecido leve e elástico, garantindo conforto e ótimo caimento sem apertar ou marcar o corpo. Possui bordado frontal premium com “Brasil”, bandeira e estrelas, trazendo um visual moderno e marcante. Ideal para dias de jogo ou looks casuais no dia a dia. Características • Cropped feminino • Bordado frontal premium • Tecido confortável e elástico • Modelagem ajustada sem apertar Tamanho e Medidas Veste do P ao M (36 ao 4"
"1gFiHjvZ5N","Casaco De Pelúcia Inverno Feminino De Manga Longa Fofa Quente","84.99","105.57","19%","4.6","1331","48731","false","https://shopee.com.br/product/703205897/29302254546"," Material do produto: Poliéster: Poliéster Tamanho, comprimento (cm), busto (cm), manga (cm) S:comprimento 70cm,busto105 cm,manga 58cm M:comprimento 71cm,busto 110cm,manga  59cm L:comprimento 72cm,busto 115cm,manga 60cm Xl:comprimento 73cm,busto 120cm,manga 61cm 2xl:comprimento 74cm,busto 125cm,manga 62cm 3xl:comprimento 75cm,busto 130cm,manga 63cm 4xl:comprimento 76cm,busto 135cm,manga 64cm 5xl:comprimento 77cm,busto 140cm,manga 65cm Padrão de padrão: simples"
"1VwI5QwCQM","Poncho Casaco Lã Feminino Trico Blusa De Frio Inverno Bico","78.90","107.01","26%","4.9","2536","98","true","https://shopee.com.br/product/759746224/18697662220","SEJAM BEM VINDOS A LOJA SWISS BOUTIQUE   BOJO: NÃO  VESTE: 38 - 44  TAMANHO: ÚNICO  FOTO REAL DO PRODUTO TECIDO: TRICOT PREMIUM TECIDO MACIO E CONFORTÁVEL BOA ELASTICIDADE NÃO DA BOLINHAS APÓS LAVAGEM NÃO FICA TRANSPARENTE   ÚNICO 38 - 44  COMPRIMENTO DA MANGA: 15CM  COMPRIMENTO DA PEÇA: 90CM MEDIDAS DA MODELO  ALTURA: 1,67 BUSTO: 91CM CINTURA: 68CM QUADRIL: 103CM PREÇO PROMOCIONAL POR TEMPO LIMITADO. TRABALHAMOS COM PRONTA ENTREGA E ENVIOS IMEDIATOS PELA TRANSPORTADORA. TODOS NOSSOS PRODUTOS PO"
"1Lcrt7wplL","CALÇA MONTARIA FLANELADA FEMENINA COM RECORTE LATERAL NO COURO FAKE   ESTILOSA BARRETOS 2026 SABOR RODEIO COUNTRY","45.99","59.99","23%","4.7","12217","5535","true","https://shopee.com.br/product/1140971409/18099297420"," Olá sejam bem vindas a loja da PASSA OU REPASSA DO BRÁS! Observações : *Tecido: Suplex flanelado com cirrê  * Produtos a pronta entrega  * Fotos reais e atualizadas * Tamanho P veste 36/38 cos 66cm altura 96cm * Tamanho M veste 38/40 cos 70cm altura 97cm * Tamanho G veste 40/42 cos 74cm altura 98cm * Tamanho GG veste 42/44 cos 78cm altura 99cm * Tamanho G1 veste 44/46 cos 82cm altura 100cm * Tamanho G2 veste 46/48 cos 86cm altura 101cm * Tamanho G3 veste 48/50 cos 92cm altura 102cm *Dúvidas? Es"
"2VopHGsOOa","Blusa T-shirt Feminina Cruz Coração Confortável 100% Algodão Presente Dia Das Mães","9.59","79.90","88%","4.4","113","43417","false","https://shopee.com.br/product/681967866/28685749130","Camiseta Casual em Algodão Eleve seu estilo casual com nossa camiseta masculina em algodão, projetada para proporcionar conforto e estilo em qualquer ocasião. Fabricada com 100% algodão de alta qualidade, essa camiseta é macia e respirável, ideal para o uso diário. Adicione um toque de personalidade ao seu guarda-roupa com nossas camisetas masculinas de estampas DTF, uma escolha perfeita para quem valoriza estilo e conforto. Renove seu visual e destaque-se com essa peça essencial!  TABELA DE MED"
"2LVP4xt1jZ","Vestido Femenino Chemise Longo Elegante Plus Size Con Botões, Manga Ajustable,3/4,Tecido Viscolinho","67.15","85.00","21%","4.9","3434","34217","true","https://shopee.com.br/product/1114798043/22498290460","Vestido femenino Midi Camisero Elegante e Versátil Sabe aquela peça curinga que você veste e já se sente linda e pronta para tudo? Esse vestido chemise midi é exatamente assim! Feito em viscolinho leve, com caimento soltinho e um toque macio, ele une o que a gente mais ama: conforto, estilo e praticidade. Com um design moderno e atemporal, ele tem abotoamento frontal, que permite brincar com decotes e sobreposições, e mangas ajustáveis, ideais para qualquer estação. E o charme extra? Uma fenda l"
